testcases/all_1.in:2> CREATE TABLE course (sid INT, homework INT, project INT, exam INT, grade STR20)

testcases/all_1.in:3> INSERT INTO course (sid, homework, project, exam, grade) VALUES (1, 99, 100, 100, "A")

testcases/all_1.in:4> SELECT * FROM course
+-----+----------+---------+------+-------+
| sid | homework | project | exam | grade |
+-----+----------+---------+------+-------+
|   1 |       99 |     100 |  100 | A     |
+-----+----------+---------+------+-------+
1 row in set

testcases/all_1.in:5> INSERT INTO course (sid, homework, project, exam, grade) VALUES (2, 0, 100, 100, "E")

testcases/all_1.in:6> SELECT * FROM course
+-----+----------+---------+------+-------+
| sid | homework | project | exam | grade |
+-----+----------+---------+------+-------+
|   1 |       99 |     100 |  100 | A     |
+-----+----------+---------+------+-------+
|   2 |        0 |     100 |  100 | E     |
+-----+----------+---------+------+-------+
2 rows in set

testcases/all_1.in:7> INSERT INTO course (sid, grade, exam, project, homework) VALUES (3, "E", 100, 100, 100)

testcases/all_1.in:8> SELECT * FROM course
+-----+----------+---------+------+-------+
| sid | homework | project | exam | grade |
+-----+----------+---------+------+-------+
|   1 |       99 |     100 |  100 | A     |
+-----+----------+---------+------+-------+
|   2 |        0 |     100 |  100 | E     |
+-----+----------+---------+------+-------+
|   3 |      100 |     100 |  100 | E     |
+-----+----------+---------+------+-------+
3 rows in set

testcases/all_1.in:9> INSERT INTO course (sid, homework, project, exam, grade) SELECT * FROM course

testcases/all_1.in:10> SELECT * FROM course
+-----+----------+---------+------+-------+
| sid | homework | project | exam | grade |
+-----+----------+---------+------+-------+
|   1 |       99 |     100 |  100 | A     |
+-----+----------+---------+------+-------+
|   2 |        0 |     100 |  100 | E     |
+-----+----------+---------+------+-------+
|   3 |      100 |     100 |  100 | E     |
+-----+----------+---------+------+-------+
|   1 |       99 |     100 |  100 | A     |
+-----+----------+---------+------+-------+
|   2 |        0 |     100 |  100 | E     |
+-----+----------+---------+------+-------+
|   3 |      100 |     100 |  100 | E     |
+-----+----------+---------+------+-------+
6 rows in set

testcases/all_1.in:11> DELETE FROM course WHERE grade = "E"

testcases/all_1.in:12> SELECT * FROM course
+-----+----------+---------+------+-------+
| sid | homework | project | exam | grade |
+-----+----------+---------+------+-------+
|   1 |       99 |     100 |  100 | A     |
+-----+----------+---------+------+-------+
|   1 |       99 |     100 |  100 | A     |
+-----+----------+---------+------+-------+
2 rows in set

testcases/all_1.in:13> INSERT INTO course (sid, homework, project, exam, grade) VALUES (4, 99, 100, 100, "B")

testcases/all_1.in:14> SELECT * FROM course
+-----+----------+---------+------+-------+
| sid | homework | project | exam | grade |
+-----+----------+---------+------+-------+
|   1 |       99 |     100 |  100 | A     |
+-----+----------+---------+------+-------+
|   1 |       99 |     100 |  100 | A     |
+-----+----------+---------+------+-------+
|   4 |       99 |     100 |  100 | B     |
+-----+----------+---------+------+-------+
3 rows in set

testcases/all_1.in:15> DELETE FROM course

testcases/all_1.in:16> SELECT * FROM course
Empty set

testcases/all_1.in:17> DROP TABLE course

